index;Dirección;Precio;Rebajado%;Habitaciones;Planta;m2;Ascensor;Baños;Coordenadas;Barrio
0;Piso en avenida gola de puchol, 1, El Saler;329000;0;3;  2ª exterior;102.0;1.0;2;;EL SALER
1;Piso en calle de Luis Janini, 2, Masarrochos/Massarrojos;150000;0;4;  4ª exterior;100.0;1.0;1;;MASSARROJOS
2;Piso en avenida Gola del Puchol, 2, El Saler;210000;0;2;  8ª exterior;80.0;1.0;1;;EL SALER
3;Dúplex en calle El Ancla, 6, El Perellonet;217900;0;3;  4ª exterior;94.0;1.0;3;39.473244312116854, -0.38228815063662114;EL PILAR
4;Casa o chalet independiente en camino Calvario, 11, Carpesa;115000;0;1;;40.0;0.0;1;;CARPESA
5;Piso en avenida Gola de Puchol, 13, El Saler;312000;0;2;  10ª exterior;100.0;1.0;1;;EL SALER
6;Chalet adosado en calle dels Calciners, 14, Masarrochos/Massarrojos;395000;0;4;;197.0;0.0;3;;MASSARROJOS
7;Chalet adosado en rocafort, 18, Masarrochos/Massarrojos;315000;0;5;;176.0;0.0;3;;MASSARROJOS
8;Piso en avenida de la Gola del Puchol, 18, El Saler;249000;0;2;  12ª exterior;84.0;1.0;2;;EL SALER
9;Chalet pareado en cuadina, 22, Castellar-Oliveral;199000;0;4;;353.0;0.0;1;;CASTELLAR-OLIVERAL
11;Piso en avenida Gola de Puchol, 24, El Saler;210000;0;2;  6ª exterior;65.0;1.0;1;;EL SALER
12;Piso en avenida Gola del Puchol, 25, El Saler;265000;10;2;  2ª exterior;110.0;1.0;2;;EL SALER
13;Piso en avenida Gola del Puchol, 26, El Saler;165000;0;2;  1ª exterior;80.0;1.0;1;;EL SALER
14;Chalet adosado en calle de Karl Marx, 58, Forn de Alcedo;205000;0;4;;200.0;0.0;3;;FORN DE ALCEDO
15;Chalet adosado en Gavines, 143, El Saler;295000;0;3;;100.0;0.0;1;;EL SALER
16;Chalet adosado en calle de José Aguilar, Aiora, València;430000;0;6;;242.0;0.0;3;39.4647266, -0.3404832;AIORA
17;Piso en calle de Peris Brell, Aiora, València;130000;0;5; exterior;77.0;0.0;1;39.4664775, -0.3468997;AIORA
18;Piso en calle de Berenguer Mallol, 4, Aiora, València;199000;0;5;  1ª exterior;100.0;1.0;1;39.4651195, -0.3448081;AIORA
19;Piso en calle de Ramiro de Maeztu, 35, Aiora, València;180000;0;4;  5ª exterior;102.0;1.0;1;39.4667408, -0.3453094;AIORA
20;Piso en calle de l'Alcalde Cano Coloma, Aiora, València;235000;2;4;  4ª interior;121.0;1.0;2;39.4662232, -0.3362533;AIORA
21;Ático en calle de joan baptista perales, Aiora, València;398000;0;4;  4ª exterior;128.0;1.0;2;39.46573283778116, -0.34335984023183125;AIORA
22;Piso en cano alcade coloma, s/n, Aiora, València;210000;0;4;  1ª interior;117.0;1.0;2;39.46573283778116, -0.34335984023183125;AIORA
23;Piso en calle Marino Albesa, Aiora, València;295000;0;3; Bajo exterior;150.0;0.0;1;39.4659127, -0.3450164;AIORA
24;Piso en calle dels Lleons, 27, Aiora, València;115000;0;3;  4ª exterior;74.0;0.0;1;39.4678648, -0.3477092;AIORA
25;Piso en calle del Mestre Valls, Aiora, València;180000;0;3;  5ª interior;75.0;1.0;1;39.4651018, -0.3417306;AIORA
26;Piso en Mestre Valls, Aiora, València;180000;0;3;  5ª interior;75.0;1.0;1;39.4651018, -0.3417306;AIORA
27;Piso en calle del Ferro, 29, Aiora, València;110000;0;3;  4ª exterior;67.0;0.0;1;39.4638891, -0.339693;AIORA
28;Piso en calle del Maestro Valls, Aiora, València;180000;0;3;  5ª interior;75.0;1.0;1;39.4651018, -0.3417306;AIORA
29;Piso en calle del Maestro Valls, Aiora, València;180000;14;3;  5ª interior;75.0;1.0;1;39.4651018, -0.3417306;AIORA
30;Piso en calle los Leones, Ciutat Jardí, València;148000;0;3;  1ª exterior;74.0;1.0;1;39.4678648, -0.3477092;AIORA
31;Piso en Floresta, Aiora, València;149900;0;3;  4ª exterior;84.0;1.0;1;39.4662897, -0.3490823;AIORA
32;Piso en calle Francisco de Bellvís, 17, Aiora, València;170000;0;3;  3ª exterior;80.0;1.0;1;39.4647266, -0.3404832;AIORA
33;Piso en calle los Leones, Aiora, València;175000;0;3;  2ª exterior;78.0;0.0;1;39.4678648, -0.3477092;AIORA
35;Piso en calle los Leones, Aiora, València;180000;0;3;  1ª exterior;78.0;0.0;1;39.4678648, -0.3477092;AIORA
36;Piso en calle Santos Justo y Pastor, Aiora, València;120000;4;3;  2ª exterior;75.0;1.0;1;39.4670872, -0.3393255;AIORA
38;Piso en calle los Leones, Aiora, València;177000;0;3;  1ª exterior;80.0;1.0;1;39.4678648, -0.3477092;AIORA
39;Piso en avenida del Port, Aiora, València;199000;0;3;  4ª exterior;93.0;1.0;1;39.46573283778116, -0.34335984023183125;AIORA
40;Piso en avenida del Port, Aiora, València;159500;0;3;  5ª interior;71.0;1.0;1;39.46573283778116, -0.34335984023183125;AIORA
41;Piso en avenida del Puerto, 97, Aiora, València;160000;0;3;  5ª interior;79.0;1.0;1;39.46549832309998, -0.3500011607379576;AIORA
42;Piso en calle Muñiz y h de Alba, Aiora, València;235000;0;3;  2ª exterior;126.0;1.0;2;39.46573283778116, -0.34335984023183125;AIORA
43;Piso en calle dels Sants Just i Pastor, Aiora, València;217007;0;3;  5ª exterior;101.0;1.0;2;39.4670872, -0.3393255;AIORA
44;Piso en calle de l'Humanista Furió, Aiora, València;195000;0;3;  7ª exterior;76.0;1.0;2;39.4678537, -0.345122;AIORA
45;Piso en avenida del Puerto, Aiora, València;180000;0;3;  1ª exterior;80.0;0.0;2;39.46573283778116, -0.34335984023183125;AIORA
46;Piso en avenida del Port, Aiora, València;365000;0;3;  3ª exterior;124.0;1.0;2;39.46573283778116, -0.34335984023183125;AIORA
47;Piso en calle Serrería, Aiora, València;320000;0;3;  5ª exterior;85.0;1.0;2;39.4631277, -0.3371717;AIORA
48;Piso en avenida del port, 197, Aiora, València;280000;0;3;  6ª exterior;135.0;1.0;2;39.463035110588656, -0.34123134910059333;AIORA
49;Piso en calle de la Pobla de Farnals, Aiora, València;189900;0;3; interior;75.0;0.0;3;39.46573283778116, -0.34335984023183125;AIORA
50;Ático en avenida del Puerto, Aiora, València;190000;0;2;  3ª exterior;75.0;0.0;1;39.46573283778116, -0.34335984023183125;AIORA
51;Piso en Francisco De Bellvis, Aiora, València;150000;0;2; Bajo exterior;100.0;0.0;1;39.4647266, -0.3404832;AIORA
52;Piso en Manuel Candela, 16, Aiora, València;200000;0;2;  1ª interior;65.0;1.0;1;39.4664806, -0.3506569;AIORA
53;Piso en plaza del Organista Cabo, Aiora, València;150000;0;2;  1ª exterior;50.0;1.0;1;39.4672872, -0.3448762;AIORA
54;Dúplex en calle de la Indústria, 16, Aiora, València;169000;0;2;  2ª exterior;80.0;0.0;2;39.4658247, -0.3427926;AIORA
55;Piso en calle del Mestre Valls, Aiora, València;157000;0;1; Bajo exterior;40.0;0.0;1;39.4651018, -0.3417306;AIORA
56;Piso en calle de l'Actor Llorens, Albors, València;235000;5;4;  1ª exterior;141.0;1.0;2;39.4684395, -0.3546611;ALBORS
57;Piso en calle de l'Actor Llorens, Albors, València;235000;5;4;  1ª exterior;144.0;1.0;2;39.4684395, -0.3546611;ALBORS
58;Piso en calle de l'Actor Llorens, Albors, València;247000;0;4;  1ª exterior;144.0;1.0;2;39.4684395, -0.3546611;ALBORS
59;Piso en calle de la Pobla de Farnals, Albors, València;220000;0;4;  1ª exterior;107.0;1.0;2;39.4685360289242, -0.3527590074283793;ALBORS
60;Piso en Albors, València;225000;0;4;  7ª exterior;118.0;1.0;2;39.4683693, -0.3528929;ALBORS
62;Piso en Aben Alabar, Albors, València;240000;2;4;  7ª interior;103.0;1.0;2;39.4685360289242, -0.3527590074283793;ALBORS
63;Piso en calle d'Abén al Abbar, Albors, València;225000;0;4;  1ª interior;103.0;0.0;2;39.4672057, -0.3525983;ALBORS
65;Piso en calle d'Abén al Abbar,, Albors, València;225000;0;4; Entreplanta interior;103.0;1.0;2;39.4672057, -0.3525983;ALBORS
66;Piso en calle Abén al Abbar, Albors, València;225000;0;4;  1ª interior;103.0;1.0;2;39.4672057, -0.3525983;ALBORS
68;Piso en calle Abén al Abbar, Albors, València;240000;0;4;  7ª interior;134.0;1.0;2;39.4672057, -0.3525983;ALBORS
69;Piso en avenida del Puerto, Albors, València;345000;0;4;  2ª exterior;145.0;1.0;2;39.4685360289242, -0.3527590074283793;ALBORS
70;Piso en calle de la Puebla de Farnals, Aiora, València;129900;7;3;  3ª exterior;70.0;1.0;1;39.4689983, -0.3496602;ALBORS
71;Piso en Albors, València;180000;0;3;  3ª exterior;89.0;1.0;1;39.4683693, -0.3528929;ALBORS
73;Piso en avenida Cardenal Benlloch, Albors, València;195000;0;3;  1ª interior;73.0;0.0;1;39.4690308, -0.3554933;ALBORS
75;Piso en Av. Cardenal Benlloch, Albors, València;195000;0;3;  1ª interior;73.0;1.0;1;39.4690308, -0.3554933;ALBORS
76;Ático en Albors, València;330000;0;3;  7ª exterior;129.0;1.0;1;39.4683693, -0.3528929;ALBORS
77;Piso en Albors, València;229000;0;3;  4ª exterior;82.0;0.0;1;39.4683693, -0.3528929;ALBORS
78;Piso en calle de la Puebla de Farnals, 36, Albors, València;168000;0;3;  2ª exterior;91.0;1.0;1;39.46911195, -0.3505935894749283;ALBORS
79;Piso en Albors, València;179900;0;3;  2ª exterior;90.0;1.0;1;39.4683693, -0.3528929;ALBORS
80;Piso en avenida del Port, Albors, València;335000;0;3;  1ª exterior;81.0;1.0;2;39.4685360289242, -0.3527590074283793;ALBORS
81;Piso en calle de Rugat, 18, Albors, València;169000;0;3;  8ª exterior;100.0;1.0;2;39.4685360289242, -0.3527590074283793;ALBORS
82;Piso en avenida del Cardenal Benlloch, Albors, València;425000;0;3;  8ª exterior;150.0;1.0;2;39.4690308, -0.3554933;ALBORS
83;Piso en avenida del Cardenal Benlloch, 54, Albors, València;170000;0;2;  7ª interior;60.0;1.0;1;39.4699173, -0.3549464;ALBORS
84;Piso en Albors, València;185000;5;2;  1ª exterior;79.0;1.0;1;39.4683693, -0.3528929;ALBORS
86;Piso en avenida del Cardenal Benlloch, Albors, València;199000;0;2;  1ª exterior;70.0;0.0;1;39.4690308, -0.3554933;ALBORS
87;Ático en avenida del Cardenal Benlloch, Albors, València;450000;0;2;  8ª exterior;142.0;1.0;2;39.4690308, -0.3554933;ALBORS
88;Ático en calle Abén al Abbar, Albors, València;315000;0;2;  5ª exterior;65.0;1.0;2;39.4672057, -0.3525983;ALBORS
89;Estudio en Angel Guimera, La Petxina, València;245000;0;0;3ª exterior;75.0;1.0;1;39.4707082, -0.3852892;ARRANCAPINS
90;Estudio en Arrancapins, València;190000;0;0;9ª exterior;48.0;1.0;1;39.4642207, -0.3842555;ARRANCAPINS
91;Estudio en calle Bailen, s/n, Arrancapins, València;138000;0;0;exterior;36.0;1.0;1;39.46409868430062, -0.38426520352944155;ARRANCAPINS
92;Estudio en Arrancapins, València;305000;0;0;4ª exterior;205.0;0.0;2;39.4642207, -0.3842555;ARRANCAPINS
93;Piso en avenida de Perez Galdos, Arrancapins, València;250000;0;14;  1ª exterior;300.0;1.0;3;39.4642104, -0.3876669;ARRANCAPINS
94;Piso en Albacete, Arrancapins, València;398000;0;7;  1ª exterior;230.0;1.0;2;39.4618305, -0.385241;ARRANCAPINS
95;Piso en Albacete, 40, Arrancapins, València;398000;0;7;  1ª exterior;230.0;1.0;2;39.46364, -0.3840311;ARRANCAPINS
96;Piso en calle d'Honorat Juan, Arrancapins, València;227990;0;6;  4ª exterior;124.0;1.0;1;39.4646542, -0.3866904;ARRANCAPINS
98;Piso en calle del Doctor Sanchis Sivera, Arrancapins, València;452000;0;6;  9ª exterior;210.0;1.0;2;39.4692611, -0.385548;ARRANCAPINS
99;Piso en calle de Maluquer, Arrancapins, València;568000;0;6; exterior;274.0;1.0;3;39.4634361, -0.3857063;ARRANCAPINS
100;Piso en Gran Vía de Ramón y Cajal, 61, Arrancapins, València;359000;0;6;  1ª exterior;185.0;1.0;3;39.4685228, -0.384037;ARRANCAPINS
101;Piso en calle timoneda, Arrancapins, València;314000;0;5;  1ª exterior;179.0;1.0;2;39.4698887, -0.3874586;ARRANCAPINS
102;Piso en Arrancapins, València;430000;0;5;  8ª exterior;206.0;1.0;2;39.4642207, -0.3842555;ARRANCAPINS
103;Piso en calle de Conca, Arrancapins, València;380000;0;5;  4ª;186.0;1.0;2;39.465511, -0.3872397;ARRANCAPINS
104;Piso en Gran Vía de Ramón y Cajal, Arrancapins, València;292000;0;5;  3ª exterior;135.0;1.0;2;39.4630924, -0.3785631;ARRANCAPINS
105;Piso en calle de Conca, Arrancapins, València;269500;0;5;  7ª exterior;142.0;1.0;2;39.465511, -0.3872397;ARRANCAPINS
106;Piso en calle de Conca, Arrancapins, València;269500;0;5;  7ª exterior;143.0;1.0;2;39.465511, -0.3872397;ARRANCAPINS
107;Piso en calle de Conca, s/n, Arrancapins, València;269500;0;5; exterior;142.0;1.0;2;39.46409868430062, -0.38426520352944155;ARRANCAPINS
108;Piso en Ramón y Cajal, Arrancapins, València;414000;0;5;  6ª exterior;176.0;1.0;2;39.46409868430062, -0.38426520352944155;ARRANCAPINS
109;Piso en calle de Jesús, Arrancapins, València;300000;6;5;  2ª exterior;149.0;1.0;2;39.4669944, -0.3827158;ARRANCAPINS
110;Piso en Arrancapins, València;300000;6;5;  2ª exterior;149.0;1.0;2;39.4642207, -0.3842555;ARRANCAPINS
111;Piso en Gran Vía de Fernando el Católico, La Petxina, València;320000;0;5;  7ª exterior;132.0;1.0;2;39.4712193, -0.3854981;ARRANCAPINS
112;Piso en Arrancapins, València;269500;0;5; Bajo exterior;142.0;1.0;2;39.4642207, -0.3842555;ARRANCAPINS
113;Piso en calle de Sant Francesc de Borja, Arrancapins, València;350000;0;5;  6ª exterior;160.0;1.0;2;39.46409868430062, -0.38426520352944155;ARRANCAPINS
114;Piso en Arrancapins, València;397000;0;5;  1ª exterior;209.0;1.0;3;39.4642207, -0.3842555;ARRANCAPINS
116;Piso en Gran Vía de Ramón y Cajal, Arrancapins, València;360000;0;5;  1ª exterior;183.0;1.0;3;39.4630924, -0.3785631;ARRANCAPINS
117;Piso en Gran Vía de Ramón y Cajal, Arrancapins, València;414000;0;5;  6ª exterior;176.0;1.0;3;39.4630924, -0.3785631;ARRANCAPINS
118;Piso en Ramón y Cajal, Arrancapins, València;414000;0;5;  6ª exterior;176.0;1.0;3;39.46409868430062, -0.38426520352944155;ARRANCAPINS
119;Piso en Arrancapins, València;385000;0;5;  1ª exterior;183.0;1.0;3;39.4642207, -0.3842555;ARRANCAPINS
120;Piso en Ramón y Cajal, 25, Arrancapins, València;650000;0;5;  9ª exterior;257.0;1.0;3;39.46409868430062, -0.38426520352944155;ARRANCAPINS
121;Piso en Arrancapins, València;410000;0;4;  3ª exterior;135.0;1.0;1;39.4642207, -0.3842555;ARRANCAPINS
122;Piso en calle Angel Guimera, Arrancapins, València;258000;0;4;  6ª exterior;125.0;1.0;1;39.4698339, -0.3884109;ARRANCAPINS
123;Piso en San Vicente Martir, 172, Arrancapins, València;195000;0;4;  3ª interior;112.0;1.0;1;39.46409868430062, -0.38426520352944155;ARRANCAPINS
124;Piso en calle del Palleter, Arrancapins, València;240000;0;4;  1ª exterior;177.0;1.0;1;39.4679649, -0.385502;ARRANCAPINS
125;Piso en calle Alcira, Arrancapins, València;410000;0;4;  3ª exterior;135.0;1.0;1;39.4660476, -0.3844268;ARRANCAPINS
126;Piso en Arrancapins, València;550000;0;4;  2ª exterior;234.0;1.0;1;39.4642207, -0.3842555;ARRANCAPINS
127;Piso en Arrancapins, València;190000;3;4;  3ª interior;105.0;1.0;1;39.4642207, -0.3842555;ARRANCAPINS
129;Piso en calle de Cuenca, Arrancapins, València;310000;0;4;  1ª exterior;130.0;1.0;1;39.4679523, -0.3852529;ARRANCAPINS
130;Piso en calle d'Alzira, Arrancapins, València;410000;0;4;  3ª exterior;135.0;1.0;1;39.4660476, -0.3844268;ARRANCAPINS
131;Piso en calle de Sant Vicent Màrtir, Arrancapins, València;499000;0;4;  1ª exterior;237.0;1.0;2;39.4601672, -0.3828785;ARRANCAPINS
132;Piso en pasaje Ventura Feliu, Arrancapins, València;289000;3;4;  1ª exterior;154.0;1.0;2;39.4622818, -0.3831273;ARRANCAPINS
133;Piso en calle de Conca, Arrancapins, València;375000;4;4;  3ª exterior;182.0;1.0;2;39.465511, -0.3872397;ARRANCAPINS
134;Piso en Arrancapins, València;320000;0;4;  4ª exterior;160.0;1.0;2;39.4642207, -0.3842555;ARRANCAPINS
135;Piso en Arrancapins, València;440000;0;4;  6ª exterior;147.0;1.0;2;39.4642207, -0.3842555;ARRANCAPINS
136;Ático en calle de Sant Vicent Màrtir, Arrancapins, València;790000;0;4;  9ª exterior;201.0;1.0;2;39.4601672, -0.3828785;ARRANCAPINS
137;Piso en Arrancapins, València;355000;0;4;  3ª exterior;164.0;1.0;2;39.4642207, -0.3842555;ARRANCAPINS
138;Piso en Arrancapins, València;225000;0;4;  2ª exterior;111.0;1.0;2;39.4642207, -0.3842555;ARRANCAPINS
139;Piso en calle San Vicente Mártir, Arrancapins, València;280000;0;4;  2ª exterior;135.0;1.0;2;39.4601672, -0.3828785;ARRANCAPINS
140;Piso en calle d'Alzira, Arrancapins, València;410000;0;4;  3ª exterior;128.0;1.0;2;39.4660476, -0.3844268;ARRANCAPINS
141;Piso en Arrancapins, València;280000;0;4;  3ª exterior;151.0;1.0;2;39.4642207, -0.3842555;ARRANCAPINS
143;Piso en Ramón y Cajal, Arrancapins, València;470000;4;4;  4ª exterior;210.0;1.0;2;39.46409868430062, -0.38426520352944155;ARRANCAPINS
144;Piso en Gran Vía de Ramón y Cajal, Arrancapins, València;330000;0;4;  2ª exterior;139.0;1.0;2;39.4630924, -0.3785631;ARRANCAPINS
146;Piso en calle d'Alzira, Arrancapins, València;410000;0;4;  3ª exterior;127.0;1.0;2;39.4660476, -0.3844268;ARRANCAPINS
147;Piso en calle del Mestre Sosa, 32, Arrancapins, València;360000;0;4;  5ª exterior;155.0;1.0;2;39.4608054, -0.3838995;ARRANCAPINS
148;Piso en calle del Mestre Sosa, Arrancapins, València;695000;0;4;  7ª exterior;167.0;1.0;3;39.461369, -0.3844786;ARRANCAPINS
149;Piso en calle de Salvador Sastre, Arrancapins, València;335000;6;4;  4ª exterior;167.0;1.0;3;39.46409868430062, -0.38426520352944155;ARRANCAPINS
150;Piso en calle de Sant Vicent Màrtir, Arrancapins, València;470000;0;4;  5ª exterior;236.0;1.0;3;39.4601672, -0.3828785;ARRANCAPINS
151;Piso en Arrancapins, València;470000;10;4;  5ª exterior;236.0;1.0;3;39.4642207, -0.3842555;ARRANCAPINS
152;Piso en Buen Orden, Arrancapins, València;210000;0;3;  2ª exterior;75.0;1.0;1;39.4677938, -0.387216;ARRANCAPINS
153;Piso en calle Alcira, Arrancapins, València;410000;0;3;  3ª exterior;135.0;1.0;1;39.4660476, -0.3844268;ARRANCAPINS
154;Piso en avenida de Giorgeta, Arrancapins, València;157500;0;3;  1ª exterior;95.0;1.0;1;39.462153, -0.3865432;ARRANCAPINS
155;Piso en Arrancapins, València;250000;0;3; Bajo exterior;95.0;1.0;1;39.4642207, -0.3842555;ARRANCAPINS
156;Ático en calle D'Alberic, 18, Arrancapins, València;250000;0;3;  7ª exterior;68.0;1.0;1;39.46845175, -0.3885658250607341;ARRANCAPINS
157;Piso en calle del Mestre Sosa, Arrancapins, València;162000;0;3; exterior;92.0;1.0;1;39.461369, -0.3844786;ARRANCAPINS
158;Piso en Arrancapins, València;220000;0;3;  3ª exterior;114.0;1.0;1;39.4642207, -0.3842555;ARRANCAPINS
159;Piso en calle de Sant Vicent Màrtir, 172, Arrancapins, València;299999;0;3;  4ª exterior;120.0;1.0;1;39.4612282, -0.3827683;ARRANCAPINS
160;Piso en Doctor Gil y Morte, Arrancapins, València;320000;0;3;  1ª exterior;180.0;1.0;1;39.4622247, -0.3805893;ARRANCAPINS
161;Piso en calle Buen Orden, Arrancapins, València;245000;0;3;  2ª exterior;112.0;1.0;1;39.4677938, -0.387216;ARRANCAPINS
162;Piso en calle de Conca, Arrancapins, València;244000;0;3;  5ª exterior;97.0;1.0;2;39.465511, -0.3872397;ARRANCAPINS
163;Piso en calle de Conca, Arrancapins, València;243500;0;3;  5ª exterior;95.0;1.0;2;39.465511, -0.3872397;ARRANCAPINS
164;Piso en Passatge de Ventura Feliu, Arrancapins, València;490000;0;3;  5ª exterior;153.0;1.0;2;39.4622818, -0.3831273;ARRANCAPINS
165;Piso en calle Jesus, Arrancapins, València;398000;0;3;  3ª exterior;124.0;1.0;2;39.4659129, -0.3834729;ARRANCAPINS
166;Piso en Arrancapins, València;300000;0;3;  6ª exterior;108.0;1.0;2;39.4642207, -0.3842555;ARRANCAPINS
167;Piso en calle d'Àngel Guimerà, Arrancapins, València;362000;2;3;  5ª exterior;120.0;1.0;2;39.4702884, -0.3853374;ARRANCAPINS
168;Piso en Arrancapins, València;398000;0;3;  3ª exterior;124.0;1.0;2;39.4642207, -0.3842555;ARRANCAPINS
169;Piso en Arrancapins, València;490000;0;3;  5ª exterior;150.0;1.0;2;39.4642207, -0.3842555;ARRANCAPINS
170;Piso en calle de Conca, Arrancapins, València;245000;0;3;  5ª exterior;110.0;1.0;2;39.465511, -0.3872397;ARRANCAPINS
171;Piso en calle de Jesús, Arrancapins, València;398000;0;3;  3ª exterior;125.0;1.0;2;39.4669944, -0.3827158;ARRANCAPINS
172;Piso en calle Timoneda, Arrancapins, València;395000;0;3;  4ª exterior;158.0;1.0;2;39.4698887, -0.3874586;ARRANCAPINS
173;Piso en Arrancapins, València;380000;0;3;  2ª exterior;137.0;1.0;2;39.4642207, -0.3842555;ARRANCAPINS
174;Piso en Arrancapins, València;520000;0;3;;115.0;0.0;2;39.4642207, -0.3842555;ARRANCAPINS
175;Piso en Arrancapins, València;280000;0;3;  2ª exterior;103.0;1.0;2;39.4642207, -0.3842555;ARRANCAPINS
176;Piso en calle de Sant Josep de Calassanç, Arrancapins, València;295000;0;3;  1ª exterior;101.0;1.0;2;39.4666854, -0.3883302;ARRANCAPINS
177;Piso en Arrancapins, València;398000;28;3;  3ª exterior;124.0;1.0;2;39.4642207, -0.3842555;ARRANCAPINS
178;Piso en Arrancapins, València;242000;4;3;  1ª exterior;111.0;1.0;2;39.4642207, -0.3842555;ARRANCAPINS
179;Piso en Jesús, Arrancapins, València;350000;1;3;  3ª exterior;145.0;1.0;2;39.4594908, -0.3846583;ARRANCAPINS
180;Piso en calle de Cuenca, Arrancapins, València;244000;0;3;  5ª exterior;95.0;1.0;2;39.4679523, -0.3852529;ARRANCAPINS
182;Piso en Arrancapins, València;245000;0;3;  5ª exterior;100.0;1.0;2;39.4642207, -0.3842555;ARRANCAPINS
183;Piso en calle d'Àngel Guimerà, Arrancapins, València;275000;0;3;  3ª exterior;130.0;1.0;2;39.4702884, -0.3853374;ARRANCAPINS
184;Piso en Arrancapins, València;285000;0;3;  6ª exterior;118.0;1.0;2;39.4642207, -0.3842555;ARRANCAPINS
185;Piso en Gran Vía de Ramón y Cajal, Arrancapins, València;240000;0;3;  1ª exterior;103.0;1.0;2;39.4630924, -0.3785631;ARRANCAPINS
186;Piso en calle de Sant Josep de Calassanç, 18, Arrancapins, València;260000;0;3;  1ª exterior;109.0;1.0;2;39.4668316, -0.3885655;ARRANCAPINS
187;Piso en Arrancapins, València;390000;0;3;  1ª exterior;110.0;1.0;2;39.4642207, -0.3842555;ARRANCAPINS
188;Piso en calle de Jesús, Arrancapins, València;398000;0;3;  3ª exterior;124.0;1.0;2;39.4669944, -0.3827158;ARRANCAPINS
189;Piso en calle d'Àngel Guimerà, Arrancapins, València;330000;0;3;  5ª exterior;100.0;1.0;2;39.4702884, -0.3853374;ARRANCAPINS
190;Piso en calle Marqués de Zenete, Arrancapins, València;315000;0;3;  2ª exterior;117.0;1.0;2;39.46409868430062, -0.38426520352944155;ARRANCAPINS
191;Piso en Arrancapins, València;595000;0;3;  1ª exterior;155.0;1.0;2;39.4642207, -0.3842555;ARRANCAPINS
193;Piso en Arrancapins, València;220000;8;3;  3ª exterior;98.0;1.0;2;39.4642207, -0.3842555;ARRANCAPINS
194;Piso en Arrancapins, València;398000;0;3;  3ª exterior;125.0;1.0;2;39.4642207, -0.3842555;ARRANCAPINS
195;Piso en Arrancapins, València;400000;0;3;  5ª exterior;150.0;1.0;2;39.4642207, -0.3842555;ARRANCAPINS
196;Piso en Arrancapins, València;385000;0;3;  5ª exterior;148.0;1.0;2;39.4642207, -0.3842555;ARRANCAPINS
197;Piso en calle San Vicente/Maestro Sosa, s/n, Arrancapins, València;412000;0;3;  6ª exterior;157.0;1.0;2;39.46409868430062, -0.38426520352944155;ARRANCAPINS
198;Piso en calle San Vicente/Maestro Sosa, s/n, Arrancapins, València;434000;0;3;  3ª exterior;161.0;1.0;2;39.46409868430062, -0.38426520352944155;ARRANCAPINS
200;Piso en calle Salvador Sastre, Arrancapins, València;300000;5;3;  3ª exterior;118.0;1.0;2;39.46409868430062, -0.38426520352944155;ARRANCAPINS
201;Piso en Arrancapins, València;180000;1;3;  7ª exterior;97.0;1.0;2;39.4642207, -0.3842555;ARRANCAPINS
202;Piso en san vicente martir, Arrancapins, València;520000;0;3;  2ª exterior;115.0;1.0;2;39.46409868430062, -0.38426520352944155;ARRANCAPINS
203;Piso en calle d'Honorat Juan, Arrancapins, València;400000;0;3;  5ª exterior;150.0;1.0;2;39.4646542, -0.3866904;ARRANCAPINS
205;Piso en Arrancapins, València;350000;0;3;  2ª exterior;118.0;1.0;3;39.4642207, -0.3842555;ARRANCAPINS
206;Dúplex en calle de l'Heroi Romeu, 9, Arrancapins, València;360000;0;3;  1ª exterior;120.0;1.0;3;39.4683172, -0.3902777;ARRANCAPINS
207;Ático en calle d'Honorat Juan, Arrancapins, València;560000;0;3;  3ª exterior;204.0;1.0;3;39.4646542, -0.3866904;ARRANCAPINS
208;Piso en Arrancapins, València;180000;0;2;  3ª exterior;82.0;1.0;1;39.4642207, -0.3842555;ARRANCAPINS
209;Piso en calle de Conca, Arrancapins, València;150000;0;2;  8ª exterior;58.0;0.0;1;39.465511, -0.3872397;ARRANCAPINS
211;Piso en avenida de Giorgeta, Arrancapins, València;130000;7;2; interior;84.0;1.0;1;39.462153, -0.3865432;ARRANCAPINS
212;Piso en Arrancapins, València;225000;0;2;  3ª interior;72.0;1.0;1;39.4642207, -0.3842555;ARRANCAPINS
213;Piso en avenida de Giorgeta, 25, Arrancapins, València;195000;0;2;  3ª interior;78.0;1.0;1;39.4603892, -0.3851506;ARRANCAPINS
214;Piso en avenida de Pérez Galdós, 68, Arrancapins, València;180000;20;2;  3ª exterior;70.0;1.0;1;39.4678538, -0.390458;ARRANCAPINS
216;Piso en calle de Timoneda, Arrancapins, València;144000;0;2;  2ª interior;60.0;1.0;1;39.4698887, -0.3874586;ARRANCAPINS
217;Ático en Martin Aloy, Arrancapins, València;330000;3;2;  5ª exterior;140.0;1.0;2;39.46409868430062, -0.38426520352944155;ARRANCAPINS
218;Piso en Martin Aloy, Arrancapins, València;310000;2;2; Bajo interior;125.0;1.0;2;39.46409868430062, -0.38426520352944155;ARRANCAPINS
219;Piso en Arrancapins, València;310000;0;2;  1ª exterior;96.0;1.0;2;39.4642207, -0.3842555;ARRANCAPINS
220;Piso en calle de Martínez Aloy, Arrancapins, València;315000;0;2;  1ª exterior;106.0;1.0;2;39.46409868430062, -0.38426520352944155;ARRANCAPINS
221;Ático en calle de Martínez Aloy, Arrancapins, València;340000;0;2;  5ª exterior;145.0;1.0;2;39.46409868430062, -0.38426520352944155;ARRANCAPINS
222;Ático en Arrancapins, València;330000;0;2;  5ª exterior;112.0;1.0;2;39.4642207, -0.3842555;ARRANCAPINS
223;Piso en Arrancapins, València;340000;0;2;  4ª exterior;100.0;1.0;2;39.4642207, -0.3842555;ARRANCAPINS
224;Piso en Arrancapins, València;370000;0;2; Bajo exterior;120.0;0.0;2;39.4642207, -0.3842555;ARRANCAPINS
225;Ático en calle de Martínez Aloy, Arrancapins, València;330000;0;2;  5ª exterior;144.0;1.0;2;39.46409868430062, -0.38426520352944155;ARRANCAPINS
226;Piso en Arrancapins, València;315000;0;2;  1ª exterior;96.0;1.0;2;39.4642207, -0.3842555;ARRANCAPINS
227;Piso en calle Erudito Orellana, Arrancapins, València;299000;0;2; Bajo exterior;100.0;1.0;2;39.46409868430062, -0.38426520352944155;ARRANCAPINS
228;Piso en calle de Martínez Aloy, 7, Arrancapins, València;310000;0;2;  1ª exterior;113.0;1.0;2;39.46409868430062, -0.38426520352944155;ARRANCAPINS
229;Piso en calle de Martínez Aloy, 7, Arrancapins, València;330000;0;2;  5ª exterior;146.0;1.0;2;39.46409868430062, -0.38426520352944155;ARRANCAPINS
